{
  "schema": "stellar-trusted-verifiers-list",
  "schema_version": "1.0",
  "updated_at": "2026-09-08T00:00:00.000Z",
  "verifiers": [
    {
      "url": "https://verify.example.org",
      "manifest_url": "https://verify.example.org/verifier-manifest.json",
      "bulk_load_url": "https://api.example.org/v1/wasms",
      "display_name": "Example Verify",
      "status": "active",
      "added_at": "2026-07-01T00:00:00.000Z"
    },
    {
      "url": "https://other.example.org",
      "bulk_load_url": "https://api.other.example.org/v1/wasms",
      "display_name": "Other Verify",
      "trust_tier": "community",
      "status": "active",
      "added_at": "2026-08-14T00:00:00.000Z"
    },
    {
      "url": "https://paused.example.com",
      "display_name": "Paused Verify",
      "status": "paused",
      "added_at": "2026-06-02T00:00:00.000Z"
    }
  ]
}
